{
	"force" : true,
	"log" : "DEBUG",
	"delete_non_existing": false,
	"top_dir": "",
	"smb": {
			"shares": ["all"],
			"hide": false
	},
	"nfs": {
			"exports": ["all"]
	},
	"s3": {
		"buckets": ["all"]

	},
	"snapshot_policy": {
		"policies": ["snaps", "Secondary_mins"]

	},
	"quota": {
			"directories": ["all"],
			"additional_limit":0
	},
	"source": {
		"address": "source.example.com",
	        "port": "8000",
	        "username": "",
	        "password": "",
	        "access_token": ""
	    },
	"destination": {
	        "address": "destination.example.com",
	        "port": "8000",
	        "username": "",
	        "password": "",
	        "access_token": ""
	}
}
